{
  "$schema": "http://json-schema.org/draft-07/schema#",
  "title": "Employee",
  "description": "A single synthetic employee profile in the Northstar Services demo dataset.",
  "type": "object",
  "required": ["employee_id", "full_name", "department", "email"],
  "additionalProperties": false,
  "properties": {
    "employee_id": {
      "type": "string",
      "pattern": "^EMP[0-9]+$"
    },
    "full_name": {
      "type": "string",
      "minLength": 1
    },
    "department": {
      "type": "string",
      "minLength": 1
    },
    "email": {
      "type": "string",
      "minLength": 1
    }
  }
}
